Number of patients,Year of research,Place of research,Number of linked references,Time period of research,Funded or not funded,Number of authors,Peer review
0,2018.0,,8,Unknown,False,16,yes
555,,"Department of Advanced Medical and Surgical Sciences, University of Campania Luigi Vanvitelli, Naples, Italy",0,Unknown,False,13,yes
0,2023.0,"Federal University of Agriculture, Makurdi, Benue State, Nigeria",29,Unknown,False,5,yes
157,,"Konya City Hospital, Turkey",24,March 2019 - January 2022,False,3,yes
0,2023.0,Mexico,128,Unknown,False,13,yes
