Number of patients,Year of research,Place of research,Number of linked references,Time period of research,Funded or not funded,Number of authors,Peer review
30,2021,"British Columbia Cancer Agency, Canada",39,1997 - 2017,False,3,yes
24,2010,Italy,11,Unknown,False,15,yes
24,2014,Italy,4,Unknown,False,1,yes
130,2014,"Istituto Nazionale per lo Studio e la Cura dei Tumori-Fondazione “Giovanni Pascale” IRCCS, Naples, Italy",38,April to June 2014,False,19,yes
163,2014,"Istituto Nazionale per lo studio e la cura dei Tumori “Fondazione G Pascale” – IRCCS, Naples, Italy",28,November 2012 to October 2014,False,18,yes
